{
    "$schema": "http://json-schema.org/draft-07/schema#",
    "$id": "https://schema.oparl.org/1.1/Person",
    "title": "Person",
    "description": "{{ Person.description }}",
    "type": "object",
    "required": [
        "id",
        "type"
    ],
    "properties": {
        "id": {
            "type": "string",
            "format": "url"
        },
        "type": {
            "type": "string",
            "const": "https://schema.oparl.org/1.1/Person"
        },
        "body": {
            "description": "{{ Person.properties.body.description }}",
            "references": "Body",
            "backreference": "person",
            "cardinality": "n:1",
            "type": "string",
            "format": "url"
        },
        "name": {
            "description": "{{ Person.properties.name.description }}",
            "type": "string"
        },
        "familyName": {
            "description": "{{ Person.properties.familyName.description }}",
            "type": "string"
        },
        "givenName": {
            "description": "{{ Person.properties.givenName.description }}",
            "type": "string"
        },
        "formOfAddress": {
            "description": "{{ Person.properties.formOfAddress.description }}",
            "type": "string"
        },
        "affix": {
            "description": "{{ Person.properties.affix.description }}",
            "type": "string"
        },
        "title": {
            "description": "{{ Person.properties.title.description }}",
            "items": {
                "type": "string"
            },
            "type": "array"
        },
        "gender": {
            "description": "{{ Person.properties.gender.description }}",
            "type": "string"
        },
        "phone": {
            "description": "{{ Person.properties.phone.description }}",
            "items": {
                "type": "string"
            },
            "type": "array"
        },
        "email": {
            "description": "{{ Person.properties.email.description }}",
            "items": {
                "type": "string"
            },
            "type": "array"
        },
        "location": {
            "description": "{{ Person.properties.location.description }}",
            "references": "Location",
            "backreference": "person",
            "cardinality": "n:1",
            "type": "string",
            "format": "url"
        },
        "locationObject": {
            "description": "{{ Person.properties.locationObject.description }}",
            "type": "object",
            "schema": "Location.json"
        },
        "status": {
            "description": "{{ Person.properties.status.description }}",
            "items": {
                "type": "string"
            },
            "type": "array"
        },
        "membership": {
            "description": "{{ Person.properties.membership.description }}",
            "type": "array",
            "items": {
                "type": "object",
                "schema": "Membership.json"
            }
        },
        "image": {
            "description": "{{ Person.properties.image.description }}",
            "type": "object",
            "schema": "File.json"
        },
        "life": {
            "description": "{{ Person.properties.life.description }}",
            "type": "string"
        },
        "lifeSource": {
            "description": "{{ Person.properties.lifeSource.description }}",
            "type": "string"
        },
        "license": {
            "type": "string"
        },
        "keyword": {
            "type": "array",
            "items": {
                "type": "string"
            }
        },
        "created": {
            "type": "string",
            "format": "date-time"
        },
        "modified": {
            "type": "string",
            "format": "date-time"
        },
        "web": {
            "type": "string",
            "format": "url"
        },
        "deleted": {
            "type": "boolean"
        }
    }
}
